{
  "pack": "physics-core",
  "description": "First physics batch: one distinct intuition per question across mechanics, fluids, heat, waves, optics, electromagnetism, relativity and quantum.",
  "defaults": {
    "category": "physics",
    "visualType": "emoji",
    "reviewStatus": "reviewed",
    "reviewNotes": "Claude-authored and self-checked against standard references; pending independent expert verification.",
    "source": "Standard introductory physics (e.g. OpenStax University Physics)"
  },
  "questions": [
    {
      "id": "phy-moon-hammer-feather",
      "subcategory": "Gravity", "difficulty": "easy", "questionType": "ordering", "answerType": "choice", "emoji": "🪶",
      "scenario": "An astronaut on the Moon holds a hammer in one hand and a feather in the other, at the same height. She lets go of both at the same instant.",
      "question": "Which hits the ground first?",
      "options": ["The hammer", "The feather", "They land together"],
      "correctIndex": 2,
      "reveal": "They land together.",
      "explanation": "On Earth, air pushes back hard on a feather's big, light surface, so it drifts. The Moon has essentially no atmosphere, so gravity is the only force that matters. A heavier object does feel a stronger pull, but it also has proportionally more mass to get moving, and the two effects cancel exactly. Both speed up at about 1.6 m/s², so they hit the dust at the same moment.",
      "intuitionTrap": "Everyday life on Earth is dominated by air resistance, so we learn that heavy things fall faster.",
      "principle": "Without air resistance, gravitational acceleration does not depend on the falling object's mass.",
      "funFact": "Apollo 15 commander David Scott did exactly this on live TV in 1971, using a falcon feather: a nod to his lunar module, Falcon.",
      "goDeeper": {"equation": "a = F/m = (GMm/r²)/m = GM/r²", "text": "The object's own mass m appears in both the gravitational force and its inertia, so it cancels. Every object at the same place falls with the same acceleration."},
      "tags": ["gravity", "free-fall", "air-resistance", "moon"],
      "concepts": ["free-fall-acceleration", "air-resistance"],
      "variantGroup": "falling-objects-mass",
      "source": "NASA Apollo 15 mission record; standard mechanics"
    },
    {
      "id": "phy-ball-top-acceleration",
      "subcategory": "Mechanics", "difficulty": "medium", "questionType": "prediction", "answerType": "choice", "emoji": "⚾",
      "scenario": "You throw a ball straight up. At the very top of its flight, for an instant, it isn't moving at all.",
      "question": "At that instant, what is the ball's acceleration?",
      "options": ["Zero, because it has stopped", "About 9.8 m/s², pointing down", "Small, but pointing upward"],
      "correctIndex": 1,
      "reveal": "Still 9.8 m/s², pointing down.",
      "explanation": "Velocity and acceleration are different things. At the top, the ball's velocity is momentarily zero, but gravity never switches off, so the ball is still accelerating downward at about 9.8 m/s². That's exactly why it doesn't hover: an instant later its velocity points down. If its acceleration really were zero at the top, it would simply stay there in mid-air.",
      "intuitionTrap": "Our brains blur 'not moving' together with 'nothing is changing'.",
      "principle": "Acceleration is the rate of change of velocity; in free flight, gravity supplies a constant downward acceleration.",
      "funFact": "Passengers on 'zero-g' training flights float on the way up as well as on the way down: the plane is in free fall for the whole arc, not just the descent.",
      "assumptions": ["Ignoring air resistance"],
      "tags": ["kinematics", "acceleration", "velocity", "projectile"],
      "concepts": ["velocity-vs-acceleration", "free-fall-acceleration"],
      "variantGroup": "projectile-top"
    },
    {
      "id": "phy-circular-track-acceleration",
      "subcategory": "Circular motion", "difficulty": "medium", "questionType": "prediction", "answerType": "direction", "emoji": "🏎️",
      "scenario": "A car drives around a perfectly circular track. Its speedometer never moves from 60 km/h.",
      "question": "Is the car accelerating?",
      "options": ["No, its speed is constant", "Yes, toward the centre", "Yes, outward from the centre"],
      "correctIndex": 1,
      "reveal": "Yes, toward the centre of the circle.",
      "explanation": "In physics, acceleration means any change in velocity, and velocity includes direction. Going around a circle, the car's direction changes every instant, so it is constantly accelerating toward the centre. That centripetal acceleration is supplied by friction between the tyres and the road. The outward lean passengers feel isn't an outward force on the car; it's their bodies trying to keep going straight while the car turns beneath them.",
      "intuitionTrap": "We equate 'accelerating' with 'speeding up', and the outward lean feels like a real outward push.",
      "principle": "Velocity is a vector; changing direction at constant speed requires an acceleration of v²/r toward the centre.",
      "funFact": "On a curve of 50 m radius at 60 km/h, that centripetal acceleration is more than half of g.",
      "goDeeper": {"equation": "a = v²/r", "text": "At 16.7 m/s on a 50 m radius, a = 16.7²/50 ≈ 5.6 m/s², about 0.57 g. Double the speed and the required acceleration quadruples, which is why fast cornering demands so much grip."},
      "tags": ["circular-motion", "acceleration", "centripetal"],
      "concepts": ["centripetal-acceleration", "velocity-vs-acceleration"],
      "variantGroup": "constant-speed-circle"
    },
    {
      "id": "phy-elevator-scale",
      "subcategory": "Mechanics", "difficulty": "easy", "questionType": "prediction", "answerType": "comparison", "emoji": "🛗",
      "scenario": "You stand on a bathroom scale inside an elevator. The doors close and the elevator starts speeding up as it heads upward.",
      "question": "While it's speeding up, what does the scale show?",
      "options": ["More than your normal weight", "Less than your normal weight", "Exactly your normal weight"],
      "correctIndex": 0,
      "reveal": "More than your normal weight.",
      "explanation": "A scale measures how hard it pushes up on you. To accelerate you upward, the floor has to push harder than gravity pulls down; the extra push is what speeds you up. So the reading rises. Once the elevator reaches a steady speed, even while still climbing, the reading returns to normal: constant velocity needs no extra force. You feel acceleration, not motion.",
      "intuitionTrap": "It's tempting to think 'going up' makes you heavier for the whole ride, but only the speeding-up part does.",
      "principle": "Apparent weight = m(g + a): only acceleration changes what a scale reads.",
      "funFact": "When the elevator slows to a stop at the top, the reading drops below normal for a moment. Briefly, you weigh less.",
      "goDeeper": {"equation": "N − mg = ma  →  N = m(g + a)", "text": "With a = 1 m/s² upward, a 70 kg person's scale reading rises from about 70 kg to about 77 kg."},
      "tags": ["apparent-weight", "newtons-second-law", "elevator"],
      "concepts": ["apparent-weight", "newtons-second-law"],
      "variantGroup": "elevator-apparent-weight"
    },
    {
      "id": "phy-spaceship-push-off",
      "subcategory": "Momentum", "difficulty": "medium", "questionType": "prediction", "answerType": "choice", "emoji": "🚀",
      "scenario": "You're inside a spaceship coasting through deep space with its engines off, far from any planet. You crouch on the floor and push off hard with your legs, as if jumping.",
      "question": "What happens next?",
      "options": ["You rise, slow down and fall back", "You glide to the ceiling at steady speed", "You barely move without gravity"],
      "correctIndex": 1,
      "reveal": "You glide to the ceiling at a steady speed.",
      "explanation": "With the engines off, you and the ship are both in free fall, so nothing pulls you back toward the floor. When your legs push on the floor, the floor pushes back on you, and you drift toward the ceiling at a constant speed until you hit it. The ship gets a tiny nudge the other way, but it's so massive that its recoil is barely noticeable. To push off you don't need gravity, just something to push against.",
      "intuitionTrap": "On Earth every jump ends with a fall, so we expect a return trip.",
      "principle": "With no net external force, motion continues in a straight line at constant speed; every push comes with an equal and opposite push.",
      "caveat": "If the engines were firing, the ship's acceleration would act like gravity and you would land back on the floor.",
      "funFact": "Astronauts on the International Space Station move around exactly like this, gently pushing off the walls with their fingertips.",
      "tags": ["inertia", "newtons-third-law", "spaceflight", "weightlessness"],
      "concepts": ["newtons-first-law", "newtons-third-law"],
      "variantGroup": "jump-in-space"
    },
    {
      "id": "phy-heat-flow-hot-bearing",
      "subcategory": "Thermodynamics", "difficulty": "medium", "questionType": "direction", "answerType": "direction", "emoji": "🔥",
      "scenario": "A small steel bearing heated to 200 °C is dropped onto a huge iron block at 40 °C. The block stores far more total thermal energy than the little bearing.",
      "question": "Which way does heat flow?",
      "options": ["From the bearing into the block", "From the block into the bearing", "Neither, until their energies match"],
      "correctIndex": 0,
      "reveal": "From the hot bearing into the big block.",